<?xml version="1.0" encoding="UTF-8"?>
<xs:schema xmlns:xs="http://www.w3.org/2001/XMLSchema">
    <xs:element name="students">
        <xs:complexType>
            <xs:sequence> 
                <xs:element name="student" maxOccurs="unbounded">
                    <xs:complexType>
                        <xs:sequence>
                            <xs:element name="name" type="xs:string" />
                            <xs:element name="age" type="xs:string" />
                            <xs:element name="course">
                                <xs:simpleType>
                                    <xs:restriction base="xs:string">
                                        <xs:pattern value="[A-Za-z\s]{3,30}" />
                                    </xs:restriction>
                                </xs:simpleType>
                            </xs:element>
                            <xs:element name="address" type="xs:string" minOccurs="0" />
                            <xs:element name="phone">
                                <xs:simpleType>
                                    <xs:restriction base="xs:string">
                                        <xs:pattern value="\d{10}" />
                                    </xs:restriction>
                                </xs:simpleType>
                            </xs:element>
                            <xs:element name="dob" type="xs:date" />
                            <xs:element name="Jyear" type="xs:gYear" />
                        </xs:sequence>
                        <xs:attribute name="id" type="xs:integer" use="required" />
                    </xs:complexType>
                </xs:element>
            </xs:sequence>
        </xs:complexType>
    </xs:element>
</xs:schema>
